title,url,summary,time,author
Thiết bị 'hiểu' đất bằng AI đoạt giải về giải pháp xanh,https://vnexpress.net/thiet-bi-hieu-dat-bang-ai-doat-giai-ve-giai-phap-xanh-4870256.html,Bộ thiết bị đo chất lượng đất bằng AI của Enfarm là một trong ba giải pháp đoạt giải Startup bền vững được yêu thích.,"Thứ bảy, 5/4/2025, 09:09 (GMT+7)",Bảo Lâm
'Cha đẻ' Internet và các chuyên gia lo con người lệ thuộc AI,https://vnexpress.net/cha-de-internet-va-cac-chuyen-gia-lo-con-nguoi-le-thuoc-ai-4869747.html,"""Cha đẻ"" Internet Vinton Cerf và nhiều chuyên gia lo ngại AI sẽ khiến con người mất đi kỹ các năng cốt lõi, như sự đồng cảm hay tư duy sâu.","Thứ sáu, 4/4/2025, 16:33 (GMT+7)","Bảo Lâm (theo CNN, TechCrunch)"
Cơn sốt 'đóng vỉ chân dung' bằng ChatGPT,https://vnexpress.net/con-sot-dong-vi-chan-dung-bang-chatgpt-4869364.html,Tính năng tạo hộp đồ chơi figure với hình ảnh bản thân bằng ChatGPT được nhiều người hào hứng chia sẻ trên mạng xã hội.,"Thứ năm, 3/4/2025, 16:22 (GMT+7)",Bảo Lâm
DeepSeek vượt ChatGPT về lượt truy cập mới hàng tháng,https://vnexpress.net/deepseek-vuot-chatgpt-ve-luot-truy-cap-moi-hang-thang-4869278.html,DeepSeek có tốc độ tăng trưởng trên nền tảng web vượt qua ChatGPT và đang là công cụ AI được dùng nhiều thứ ba trên toàn cầu.,"Thứ năm, 3/4/2025, 06:00 (GMT+7)",Hoài Anh
Người dùng ChatGPT tăng vọt nhờ AI tạo ảnh,https://vnexpress.net/nguoi-dung-chatgpt-tang-vot-nho-ai-tao-anh-4868976.html,"Tính năng AI tạo ảnh trên ChatGPT, trong đó có phong cách Ghibli, gây sốt giúp số lượng người dùng chatbot của OpenAI tăng cao và khiến máy chủ quá tải.","Thứ tư, 2/4/2025, 16:17 (GMT+7)",Bảo Lâm
